103	1	裁判所命令に違反して250ドル以上の罰金の支払いを命じられた被告はいなかった。判決が出た後、何が起こったのでしょうか？	被告人はともに罰金を支払いました。
104	1	裁判所命令に違反して250ドル以上の罰金の支払いを命じられた被告はいなかった。判決が出た後、何が起こったのでしょうか？	被告が罰金を支払った
105	0	ハミルトンは、自分たちのために自由を要求し、黒人に自由を許すことを拒否しているとして、彼の政敵を攻撃した。ハミルトンは政治家になる前は何をしていたのでしょうか？	弁護士として死去
106	0	ハミルトンは、自分たちのために自由を要求し、黒人に自由を許すことを拒否しているとして、彼の政敵を攻撃した。ハミルトンは政治家になる前は何をしていたのでしょうか？	家の所有者が購入希望者に売ることを拒否する
107	0	また、家の裏にある小さな森を通ってかくれんぼをするのも好きでした。かくれんぼをした後、彼らは何をしたのでしょうか？	かくれんぼゲームの前に空港に行ったよ。
108	1	また、家の裏にある小さな森を通ってかくれんぼをするのも好きでした。かくれんぼをした後、彼らは何をしたのでしょうか？	家に帰った
109	0	私がまだ爆発、乗組員の死、そして救助に巻き込まれていたことを考えると、それはどういうわけか関連性があるようには見えませんでした。乗組員の死後、何があったんですか？	クルーメイトがパーティーをした
110	0	これとは別に、シタデルは第3四半期に230万ドル（1株当たり68セント）の純損失を計上しましたが、前年同期は530万ドル（1株当たり1.61ドル）の純利益を計上しました。シタデルは第3四半期が終了する前に収益を報告しましたか？	はい、年初に報告しました。
111	1	サラは、その夜博物館を離れているシングルファーザーである管理者のマイケル・ピアースと付き合っています。マイケルが離れたことを知ったサラは何をしたのか？	サラは彼を呼んだ
112	1	彼らは初めて飛行機でヨーロッパを旅し、様々な人や景色を見てきました。飛行機が着陸した後に何が起こったのでしょうか？	彼らは探検していました
113	1	彼女が去る直前、ターシャは「あなたは芸術のために人生から盗むのよ、ベルナルド」と言った。ベルナルドは次に何をしたのでしょうか？	ターシャを自宅から追い出した。
114	0	二人は親しい友人になるが、秘密を明らかにしない。彼らは友達になった後、何をしていたのでしょうか？	彼らはお互いに殴り合った
115	0	二人は親しい友人になるが、秘密を明らかにしない。彼らは友達になった後、何をしていたのでしょうか？	彼らはそうしないことを選んだ
116	1	犬抑留所にいる子犬たちは皆、愛情のこもった家を必要としています。家が見つかった後はどうなりますか？	子犬は新しい家族と一緒に暮らすことになります。
117	1	例えば、銅製のペニーを酢の中に入れておくと、銅製のペニーについてしまったくすみを元に戻すことができます。銅製のペニーを酢の中に入れた後はどうすればいいのでしょうか？	そこに座らせる
118	0	例えば、銅製のペニーを酢の中に入れておくと、銅製のペニーについてしまったくすみを元に戻すことができます。銅製のペニーを酢の中に入れた後はどうすればいいのでしょうか？	オーブンに入れて乾燥させる
119	0	昨日の昼過ぎのロンドンでは、ラトナーズ株は2ペンス（1.26セント）上昇し、260ペンス（1.64ドル）となりました。株が上昇した後、何が起こったのか？	経済が崩壊した
120	0	移行があり、[クリニック]は、いくつかの空白を埋めるのに役立っていると、東部地区高等裁判所の管理者であるデニ・バトラーは述べています。移行後に何が起こったのか？	真空が始まった
121	1	移行があり、[クリニック]は、いくつかの空白を埋めるのに役立っていると、東部地区高等裁判所の管理者であるデニ・バトラーは述べています。移行後に何が起こったのか？	物事がよりスムーズに進みました。
122	0	びしょ濡れになった彼は、私が芝生の上でサンドイッチを食べているところに走ってきて、私の膝の上で丸くなったので、私は彼を気持ちよくさせてあげようとしました。彼が彼女の膝の上に横たわった後、何があったのでしょうか？	二人は家に帰りました
123	0	びしょ濡れになった彼は、私が芝生の上でサンドイッチを食べているところに走ってきて、私の膝の上で丸くなったので、私は彼を気持ちよくさせてあげようとしました。膝の上に横たわった後は？	足を床につけた
124	1	8月のミサイル攻撃の後、タリバンに圧力をかけるための外交的な選択肢は、軍事的な選択肢よりも有望ではないように見えた。空爆の後に何が起こったのか	たくさんの市民が死んだ
125	0	シェリーは全てのケージに行き、一匹一匹の子犬の目を見て、一匹一匹に話しかけました。子犬たちと話した後、シェリーは何をしたのでしょうか？	彼女はケージを蹴りました。
126	0	シェリーは全てのケージに行き、一匹一匹の子犬の目を見て、一匹一匹に話しかけました。子犬たちと話した後、シェリーは何をしたのでしょうか？	彼女は檻をを蹴りました。
127	0	シェリーは全てのケージに行き、一匹一匹の子犬の目を見て、一匹一匹に話しかけました。子犬たちと話した後、シェリーは何をしたのでしょうか？	お昼寝をしました。
128	0	敵の結束力にダメージを与えたフィリップは、彼の軍隊に前進を命じ、すぐに彼らを追い詰めた。フィリップは軍隊を追い詰めた後、何をしたか？	止まるように言った
129	1	敵の結束力にダメージを与えたフィリップは、彼の軍隊に前進を命じ、すぐに彼らを追い詰めた。フィリップは軍隊を追い詰めた後、何をしたか？	フィリップはさらに命令を出した
130	0	偵察船は、ビロードのような黒さの球体から現れた輝かしい斑点の穴から再び現れた。偵察船は次に何をしたのでしょうか？	それは数ヶ月間停止しました
131	0	氷河と呼ばれる巨大な氷床が、今日見られる土地に特徴をもたらしました。氷河が土地に特徴をもたらした後、何が起こったのでしょうか？	特徴は元の状態に逆戻りしました
132	0	氷河と呼ばれる巨大な氷床が、今日見られる土地に特徴をもたらしました。氷河が土地に特徴をもたらした後、何が起こったのでしょうか？	氷が2日間形成されました。
133	1	彼は30分ほど弾き語りを続けてノートを書き、二階の書斎に行き、エルザが料理を運んできてくれて二週間滞在しました。書斎を出た後はどうなったのでしょうか？	楽譜をマスターしていた
134	0	アナは、スペリングが上手になるように一生懸命勉強しました。アナは一生懸命勉強した後、何をしたのでしょうか？	レストランで働くのをやめた
135	0	擬テンソルのような非共変オブジェクトの使用は、1917年にエルヴィン・シュレディンガーなどによって強く批判されました。シュレディンガーが非共変オブジェクトの使用に反対した後、何が起こったのでしょうか？	彼らはさらに使われるようになった
136	0	擬テンソルのような非共変オブジェクトの使用は、1917年にエルヴィン・シュレディンガーなどによって強く批判されました。シュレディンガーが非共変オブジェクトの使用に反対した後、何が起こったのでしょうか？	より使われるようになった
137	1	もう一つの例としては、私はメイプルストリートとメインストリートの角にいます。どちらの通りも、あなたの町に住んでいる人にとっては参考になるかもしれません。彼らがメープルストリートとメインストリートに住居を構えた後、何が起こったのでしょうか？	彼らは自分たちの家を装飾した
138	0	もう一つの例としては、私はメイプルストリートとメインストリートの角にいます。どちらの通りも、あなたの町に住んでいる人にとっては参考になるかもしれません。彼らがメープルストリートとメインストリートに住居を構えた後、何が起こったのでしょうか？	引っ越しのトラックが必要になった
139	1	では、光が光沢のある表面に当たった後、光がどこに行くかはどうやって分かるのでしょうか？光が反射した後、光は何をするのでしょうか？	どこか他の場所に移動します
140	1	では、光が光沢のある表面に当たった後、光がどこに行くかはどうやって分かるのでしょうか？光が反射した後、光は何をするのでしょうか？	光はどこか他の場所に移動する
141	1	ナンディー二の後をつけていたジャアヌは、ナンディーニに恋をしていると思っていたプリータムを殴りつける。ジャアヌがプリータムを殴った後、何が起こったのか？	プリータムが逃げ出す
142	1	しかし今回は、匿名のアーティストが英国のブリストル美術館の館長と協力して活動しました。彼らが一緒に仕事をした後、何が起こったのでしょうか？	アーティストは多くの作品を制作しました。
143	0	半導体の研究開発に年間5億ドル以上を費やしている。開発段階が終わったらどうなるのでしょうか？	必ずまた使うことになる
144	0	ギャンブルが合法化されたことで、アメリカ全土で合法化が進みました。ギャンブルが合法化された後、何が起こったのでしょうか?	誰もがギャンブルを止めました。
145	1	そのために、植民地の歴史の中では比較的血の滲むようなエピソードが少なく成功した。成功した後はどうなったのか？	国が栄えた
146	0	一方、カイロ博物館に保管されていたプレムのミイラは、ハスミドがシュラウドの上で神聖な誓いを唱えた時に蘇った。プレムのミイラが生き返った後、何が起こるのか？	数学のテストがある
147	1	サフティ博士は命を救うことにとても忙しいので、病気になったエドウィナを個人的に世話をすることができません。エドウィナが病気になった後、何が起こったのか？	彼女は死にました
148	1	2008年の全豪オープン決勝でツォンガを破ったセルビア人は、オーストラリア人の18歳のベルナルド・トミックの夢の舞台に終止符を打った。セルビア人がツォンガを倒す前に何があったのか？	ツォンガが一番だった
149	0	長い目で見れば買うものが少なくなるので、資源だけでなくお金も貯められるようになります。お金を貯めた後はどうなるの？	インフレになってお金がなくなる
150	0	アレクサンダーはその後、マッサーガ、オラ、アオルノスの拠点で戦ったアサケノイと戦いました。アレクサンダーはアサケノイと戦った後、何をしたのでしょうか？	彼は逃げた
151	0	NMCCはホワイトハウスからユナイテッド航空93便のことを知りました。NMCCがユナイテッド航空93便の存在を知った後、何が起きたのでしょうか？	NMCCは情報を得てユナイテッド３１の調査を開始しました
152	0	NMCCはホワイトハウスからユナイテッド航空93便のことを知りました。NMCCがユナイテッド航空93便の存在を知った後、何が起きたのでしょうか？	ホワイトハウスが拒否権を維持する
153	1	我々の調査では、米国内の人物がハイジャック犯に多額の資金援助をしたという信憑性のある証拠はありませんでした。ハイジャック犯が捕まった後は何が起こったのでしょうか？	刑務所に入れられます
154	0	石蹴り遊びや縄跳びが好きなのですが、その日は鬼ごっこがしたかったのです。鬼ごっこの後は何をしていたのでしょうか？	大事な役割を果たしています。
155	0	彼らはパラメセワラに断ることのできない申し出をした：港の設備と毎年の金銭的な貢ぎ物と引き換えに、略奪するタイ人に対する中国の保護を求めた。その後どうなったのか？	申し出を断った
156	1	彼らはパラメセワラに断ることのできない申し出をした：港の設備と毎年の金銭的な貢ぎ物と引き換えに、略奪するタイ人に対する中国の保護を求めた。その後どうなったのか？	彼らは彼の申し出を受け入れた
157	1	アインシュタインはルイ・ド・ブロイの作品を発見し、最初は懐疑的に受け止められた彼のアイデアを支持しました。アインシュタインはルイの作品を発見し、支持した後に何をしたのでしょうか？	彼は発見して触発された
158	1	アインシュタインはルイ・ド・ブロイの作品を発見し、最初は懐疑的に受け止められた彼のアイデアを支持しました。アインシュタインはルイの作品を発見し、支持した後に何をしたのでしょうか？	彼は発見して影響を受けた
159	1	オープニングシーンでは、ランディ-モートンはウォルドルフで典型的な金曜日の午後を説明します。彼はウォルドルフを出た後、何をしましたか？	家に帰って休んだ
160	1	イランコントラの悪名高いオリバー・ノースは自分のコンピューターを消したと思っていたが、後にその情報は議会の委員会が読むために回収されたと言っています。議会委員会がデータを読んだ後に何が起きたのか？	彼らは情報を処理した
161	0	イランコントラの悪名高いオリバー・ノースは自分のコンピューターを消したと思っていたが、後にその情報は議会の委員会が読むために回収されたと言っています。議会委員会がデータを読んだ後に何が起きたのか？	彼は自分のコンピュータを消去した
162	0	イランコントラの悪名高いオリバー・ノースは自分のコンピューターを消したと思っていたが、後にその情報は議会の委員会が読むために回収されたと言っています。議会委員会がデータを読んだ後に何が起きたのか？	彼らはデータを削除した
163	1	記録によると、9時25分に始まり、CIA、FBI、国務省、司法省、国防省、FAA、ホワイトハウスのシェルターが含まれていました。それが始まった後、何が起こったのですか？	行動は記録されています
164	0	彼はお気に入りの椅子に飛び乗って、マギーがその下を走るのを見下ろした。その夜、彼は何をしたのでしょうか？	日の出を見ていた
165	0	マルチネスさんは医師の助手として2つの仕事をしながら、高齢の両親と8歳の息子をサポートしています。マルチネスさんは働いた後、何をしているのでしょうか？	一人の息子は自分のキャリアを犠牲にする
166	0	世界保健機関（WHO）の報告書によると、ペルシャ湾岸戦争で国の医療インフラの多くが破壊されました。インフラが破壊された後、何が起こったのでしょうか？	彼らはそれを放っておいた
167	0	フィンリーは、彼の悪行がバイオレットの悪行をはるかに上回っていることを後知恵でのみ認識している。それを悟った後、彼は何をしたのか？	彼は投票をイエスに変えた
168	1	ランサムは彼女だけでなく、彼への愛を宣言した若いファーン・サイモンの世話をしています。ランサムとファーンはどのようにしてお互いを愛するようになったのでしょうか？	二人は公園の近くで出会った。
169	0	原子の中には電子よりも陽子の方が多く存在します。電子の数が増えた後、何が起こったのでしょうか？	電子が死んだ
170	1	例外として、性的暴行や近親相姦、その他の法律違反による妊娠などがあります。法律違反の後に何が起こったのか？	加害者が起訴された
171	0	彼らが会ったとき、ジョンは彼の父が彼を見捨てたと非難するが、彼の父は「彼はそれをジョンに任せた」と言う。ジョンと父親は出会った後、何をしているのか？	別の家に行く
172	0	彼はイスラム教徒にとってアメリカ人を殺すのは、他の異教徒を殺すことよりも重要だと主張した。彼が主張を始めた後、何が起きたのですか？	何も
173	1	人は間違った方向に半マイル歩くかもしれません！間違った方向に歩いていたことに気付いた後、その人は何をするでしょうか？	振り返って、反対方向に歩いて戻ってきます。
174	0	彼女は落ち着かない野生の馬マジェスティックの話をし始めました。彼女が話した後、何が起こったのでしょうか？	彼女は募金活動組織に勤めていた。
175	1	その後、常務弁護士、上級弁護士、高齢化対策プロジェクトのディレクターを経て、昇進を果たしました。昇進した後は何をしていたのでしょうか？	新しい職場で働いていました。
176	1	その後、常務弁護士、上級弁護士、高齢化対策プロジェクトのディレクターを経て、昇進を果たしました。昇進した後は何をしていたのでしょうか？	キャリアを楽しんでいます
177	0	その後、常務弁護士、上級弁護士、高齢化対策プロジェクトのディレクターを経て、昇進を果たしました。昇進した後は何をしていたのでしょうか？	貰わなければよかったと思ったそうです。
178	0	その後、物語は1920年に進み、科学者のバジル・ウォルデン卿とビジネスマンのスタンリー・プレストンが墓を見つけた探検を示しています。科学者は遠征の後に何をしましたか？	地下室に住む
179	1	その後、物語は1920年に進み、科学者のバジル・ウォルデン卿とビジネスマンのスタンリー・プレストンが墓を見つけた探検を示しています。科学者は遠征の後に何をしましたか？	彼はそれについての本を出版した。
180	1	彼らのお母さんは、毎週火曜日のおはなしの時間に図書館に行ってもいいと言っていました。お話の時間の後はどうなるのでしょうか？	男の子は図書館で本を探します
181	1	彼らのお母さんは、毎週火曜日のおはなしの時間に図書館に行ってもいいと言っていました。お話の時間の後はどうなるのでしょうか？	彼らは家に帰ります
182	1	タージ・ジャクソンは同誌に語った。ママは私たちが本当の子供時代を過ごせるように、誕生日パーティーや野球、家族でのお出かけなどをしてくれました。タージ・ジャクソンと彼の家族は誕生日パーティーの前に何をしていたのだろうか？	パーティー用品を買う
183	0	フーバーダムの1935年の落成式に出席した大群衆は、今では手ごわい広報機を稼働させた。開通後、訪問者は何をしたのでしょうか？	開通後、訪問者はダムで泳いだ
184	1	外国人や産業スパイ、不満を持つ従業員による電子機器の盗難は、米国企業に何十億ものコストをかけ、国際的な競争力を蝕んでいます。電子機器の盗難が発生した後、何が起こるのでしょうか？	窃盗が報告される
185	1	外国人や産業スパイ、不満を持つ従業員による電子機器の盗難は、米国企業に何十億ものコストをかけ、国際的な競争力を蝕んでいます。電子機器の盗難が発生した後、何が起こるのでしょうか？	データが競合他社に売られる
186	0	ユドは答えます、「キリストの御座にあるのはキリストではありません。」教会の後、ユドは何をするのでしょうか？	パーティー
187	1	コリントでフィリップは、スパルタを除くほとんどのギリシャの都市国家を含む「ヘレニズム同盟」（グレコ・ペルシャ戦争の古い反ペルシャ同盟をモデルにしたもの）を設立した。同盟の前に何が起こったか。	同盟はなかった
188	1	祖父母は、肉体的、精神的、経済的な負担に加えて、法的な問題に直面しています。法的な問題に直面した後、祖父母は何をすべきか？	弁護士を雇う
189	1	祖父母は、肉体的、精神的、経済的な負担に加えて、法的な問題に直面しています。法的な問題に直面した後、祖父母は何をすべきか？	祖父母はパニックになる
190	1	ビリーはタンブルがオートミールを食べるのを見るのが大好きでした。オートミールを食べた後、タンブルは何をしていましたか？	朝ごはんを始めました。
191	0	ビリーはタンブルがオートミールを食べるのを見るのが大好きでした。オートミールを食べた後、タンブルは何をしていましたか？	1ヶ月を始めました。
192	1	エレン・ポラックの『性的神話の詩学』（1985年）は、教皇が女性を知性的にも肉体的にも男性よりも劣っているとみなす反フェミニストの伝統に従っていたことを論じている。エレンがこの本を作った後、何があったのか？	エレンがこの本を出版した後、教皇は批判された
193	0	ウェストバージニア大学法学部の女性党員集会の投票で選ばれ、表彰されました。受賞後、彼女は何をしていたのでしょうか？	法律を辞めた
194	1	ウェストバージニア大学法学部の女性党員集会の投票で選ばれ、表彰されました。受賞後、彼女は何をしていたのでしょうか？	自身の弁護士事務所を設立
195	1	ポモナでの法的援助の存在の欠如は、弁護士会と裁判所の役人が彼ら自身の月に一度の家族法クリニックを始めることを促しました。クリニックが開始された後、ポモナに何が起こったのでしょうか？	彼らは適切な法的代理権を持っている
196	0	ポモナでの法的援助の存在の欠如は、弁護士会と裁判所の役人が彼ら自身の月に一度の家族法クリニックを始めることを促しました。クリニックが開始された後、ポモナに何が起こったのでしょうか？	強盗が増えた
197	1	アーサーは、「では、なぜ」と突っ込みを入れた。「すべてを無視して、この迷信的な、病的な、異教的な戯言に戻るのですか？」そもそもアーサーはどうやって怒ったのですか？	彼は彼と意見が合わなかった
198	0	アーサーは、「では、なぜ」と突っ込みを入れた。「すべてを無視して、この迷信的な、病的な、異教的な戯言に戻るのですか？」そもそもアーサーはどうやって怒ったのですか？	あなたはこのすべてを見落としている
199	0	彼の民衆は彼を壊そうとしたが、彼は心が荒んでいた。どの時点で民は彼を壊そうとしたのでしょうか？	彼らが彼を受け取る前に
200	0	彼の民衆は彼を壊そうとしたが、彼は心が荒んでいた。どの時点で民は彼を壊そうとしたのでしょうか？	結局、彼らはあきらめた
201	0	彼の民衆は彼を壊そうとしたが、彼は心が荒んでいた。どの時点で民は彼を壊そうとしたのでしょうか？	夕食後
202	0	9.11テロが起きた時、副大統領の対策本部はちょうど動き出したところだった。9.11テロの後、政府は何を決めたのでしょうか？	何もしない
